{"bucket":[{"nanos":0,"seconds":0},{"nanos":0,"seconds":86400}],"calendar":{"date":"1970-01-01","kind":"calendar","known_at":{"nanos":0,"seconds":0},"source":"11111111111111111111111111111111","source_sha256":"7777777777777777777777777777777777777777777777777777777777777777","version":{"id":"11111111111111111111111111111111","revision":"1"}},"derived_at":{"nanos":0,"seconds":172800},"received_at":{"nanos":0,"seconds":172800},"rule":{"calendar":{"id":"11111111111111111111111111111111","revision":"1"},"known_at":{"nanos":0,"seconds":0},"source":"11111111111111111111111111111111","source_sha256":"7777777777777777777777777777777777777777777777777777777777777777","version":{"id":"11111111111111111111111111111111","revision":"1"}},"source_date":"1970-01-01","timezone":"America/New_York","tzdata_revision":"synthetic-v1","version":"edgeagent.evidence.date-only-time.v1"}
